,Unnamed: 0,Unnamed: 0.1,id,conversation_id,created_at,date,timezone,place,text,hashtags,cashtags,user_id,user_id_str,username,name,day,hour,link,retweet,nlikes,nreplies,nretweets,quote_url,search,near,geo,source,user_rt_id,user_rt,retweet_id,reply_to,retweet_date,translate,trans_src,trans_dest,tweet,labels
105,105,105,1.26244e+18,1.26244e+18,1589830000000.0,18-05-2020 23:36,530,,"PM @narendramodi Ji has given a 20 Lakh Cr  package for making #AatmanirbharBharat.
He is leaving no stone unturned to make NEW INDIA & defeat COVID-19.
Lets Support him & take PLEDGE
Copy + Paste the message & take  #Pledge4AatmanirbharBharat 
Tagging @iPraveendixit @nishants79","['#aatmanirbharbharat', '#pledge4aatmanirbharbharat']",[],9.06117e+17,9.06117e+17,RakeshA12572734,Rakesh Arora Non secular🕉️ intolerant Hindu,1,23,https://twitter.com/RakeshA12572734/status/1262444476473245701,False,3,0,2,,(corona OR coronavirus OR covid OR pandemic OR lockdown OR quarantine OR covid-19 OR ppe),,"28.5934,77.2223,2000km",,,,,"[{'user_id': '906116884059250688', 'username': 'RakeshA12572734'}, {'user_id': '18839785', 'username': 'narendramodi'}, {'user_id': '210375740', 'username': 'iPraveendixit'}, {'user_id': '759403320', 'username': 'nishants79'}]",,,,,pm   ji   given   lakh   cr   packag   make   aatmanirbharbharat   leav   stone   unturn   make   new   india   defeat   covid   let   support   take   pledg   copi   past   messag   take   pledgeaatmanirbharbharat   tag  ,1
2514,2514,2514,1.26387e+18,1.26387e+18,1590170000000.0,22-05-2020 22:14,530,,"👍🏼 Watch Chennai Vs China. You'll Understand Current Situation Very Well.
#Chennai #vs #china
#Trending
#MadeInIndia #AatmaNirbharBharatAbhiyan #AatmaNirbharEconomy #COVIDー19 #coronavirus #ChinaVirus #biowar #IndiaFightsCorona #India https://twitter.com/trendingyanews/status/1263873085905780736 …","['#chennai', '#vs', '#china', '#trending', '#madeinindia', '#aatmanirbharbharatabhiyan', '#aatmanirbhareconomy', '#covidー19', '#coronavirus', '#chinavirus', '#biowar', '#indiafightscorona', '#india']",[],8.53646e+17,8.53646e+17,msdianyogi,Yogesh Late,5,22,https://twitter.com/msdianyogi/status/1263873414571479040,False,0,0,0,https://twitter.com/trendingyanews/status/1263873085905780736,(corona OR coronavirus OR covid OR pandemic OR lockdown OR quarantine OR covid-19 OR ppe),,"28.5934,77.2223,2000km",,,,,"[{'user_id': '853645650310959106', 'username': 'msdianyogi'}]",,,,,watch   chennai   v   china   understand   current   situat   well   chennai   v   china   trend   madeinindia   aatmanirbharbharatabhiyan   aatmanirbhareconomi   covid   coronaviru   chinaviru   biowar   indiafightscorona   india  ,-1
4138,4138,4138,1.26498e+18,1.26498e+18,1590430000000.0,25-05-2020 23:43,530,,"It’s really sad to know with 144868 cases India comes in the Top 10 list of Corona virus affected countries. God, please heal the World 🌍
#IndiaFightsCorona #AatmanirbharBharat #CoronaVirusUpdates #CoronaWarriors #SocialDistanacing #COVID__19 #Covid_19india pic.twitter.com/TLyxwYBUJJ","['#indiafightscorona', '#aatmanirbharbharat', '#coronavirusupdates', '#coronawarriors', '#socialdistanacing', '#covid__19', '#covid_19india']",[],1445714120.0,1445714120.0,ajayimvk,AJAY PANCHAL,1,23,https://twitter.com/ajayimvk/status/1264982827197591552,False,0,0,0,,(corona OR coronavirus OR covid OR pandemic OR lockdown OR quarantine OR covid-19 OR ppe),,"28.5934,77.2223,2000km",,,,,"[{'user_id': '1445714120', 'username': 'ajayimvk'}]",,,,,realli   sad   know   case   india   come   top   list   corona   viru   affect   countri   god   pleas   heal   world   indiafightscorona   aatmanirbharbharat   coronavirusupd   coronawarrior   socialdistanac   covid   covid   india  ,-1
5786,5786,5786,1.26568e+18,1.26568e+18,1590600000000.0,27-05-2020 22:11,530,,"Who is the #WorstMinister in Modi Cabinet?
#StopTargetingBengal
#COVID__19 #uttarakhandwildfire #coronavirus #JoinSpeakUpIndia #lockdown #VeerSavarkar #Corona #QuarantineLife #education #lockdownpuzzles #blogchatter #chinaindiaborder #Savarkar #AatmaNirbharBharatAbhiyan","['#worstminister', '#stoptargetingbengal', '#covid__19', '#uttarakhandwildfire', '#coronavirus', '#joinspeakupindia', '#lockdown', '#veersavarkar', '#corona', '#quarantinelife', '#education', '#lockdownpuzzles', '#blogchatter', '#chinaindiaborder', '#savarkar', '#aatmanirbharbharatabhiyan']",[],148028414.0,148028414.0,skalamz,Alam Shaikh ® ™⚪,3,22,https://twitter.com/skalamz/status/1265684688015851520,False,1,0,1,,(corona OR coronavirus OR covid OR pandemic OR lockdown OR quarantine OR covid-19 OR ppe),,"28.5934,77.2223,2000km",,,,,"[{'user_id': '148028414', 'username': 'skalamz'}]",,,,,worstminist   modi   cabinet   stoptargetingbeng   covid   uttarakhandwildfir   coronaviru   joinspeakupindia   lockdown   veersavarkar   corona   quarantinelif   educ   lockdownpuzzl   blogchatt   chinaindiabord   savarkar   aatmanirbharbharatabhiyan  ,-1
6106,6106,6106,1.26566e+18,1.26566e+18,1590590000000.0,27-05-2020 20:44,530,,🙏🇮🇳 *Under the able leadership of Hon’ble Prime Minister @narendramodi Ji* *total number of PPE Coveralls produced in India has crossed 1 crore today.* *A significant landmark towards the vision of #AatmaNirbharBharat.* pic.twitter.com/axdPuZ9mIe,['#aatmanirbharbharat'],[],7.97133e+17,7.97133e+17,NKAgarwal1234,N.K.AGARWAL,3,20,https://twitter.com/NKAgarwal1234/status/1265662567633915905,False,1,0,2,,(corona OR coronavirus OR covid OR pandemic OR lockdown OR quarantine OR covid-19 OR ppe),,"28.5934,77.2223,2000km",,,,,"[{'user_id': '797132904858001409', 'username': 'NKAgarwal1234'}, {'user_id': '18839785', 'username': 'narendramodi'}]",,,,,abl   leadership   hon   ble   prime   minist   ji   total   number   ppe   coveral   produc   india   cross   crore   today   signific   landmark   toward   vision   aatmanirbharbharat  ,0
6202,6202,6202,1.26607e+18,1.26607e+18,1590690000000.0,28-05-2020 23:33,530,,"Aatmanirbhar bharat #poem🙏
Subscribe my #YouTube channel.
Link :-  https://youtu.be/mwO_YeMV5QA 
#aatmanirbharbharat #india #covid_19 #coronavirus #narendramodi #bjp #lallantop #dhruvrathee #abpnews #bbcnews #aajtak #repablicnew #zeenews #indiatoday #timesofindia #economictimes #pimr pic.twitter.com/kLgGMcOCO3","['#poem', '#youtube', '#aatmanirbharbharat', '#india', '#covid_19', '#coronavirus', '#narendramodi', '#bjp', '#lallantop', '#dhruvrathee', '#abpnews', '#bbcnews', '#aajtak', '#repablicnew', '#zeenews', '#indiatoday', '#timesofindia', '#economictimes', '#pimr']",[],1.25015e+18,1.25015e+18,AjeetSi29053733,Ajeet Singh Chauhan,4,23,https://twitter.com/AjeetSi29053733/status/1266067694488600576,False,3,0,0,,(corona OR coronavirus OR covid OR pandemic OR lockdown OR quarantine OR covid-19 OR ppe),,"28.5934,77.2223,2000km",,,,,"[{'user_id': '1250153944203980800', 'username': 'AjeetSi29053733'}]",,,,,aatmanirbhar   bharat   poem   subscrib   youtub   channel   link   aatmanirbharbharat   india   covid   coronaviru   narendramodi   bjp   lallantop   dhruvrathe   abpnew   bbcnew   aajtak   repablicnew   zeenew   indiatoday   timesofindia   economictim   pimr  ,-1
176,176,176,1.26244e+18,1.26244e+18,1589820000000.0,18-05-2020 23:20,530,,"God knows but #decision of #Kejriwal is not liked by the people of Delhi bcz they are in an assumption that, this #decision will increase more #covid patients in #Delhi . #economyvshealth is the situation. @AamAadmiParty @ArvindKejriwal","['#decision', '#kejriwal', '#decision', '#covid', '#delhi', '#economyvshealth']",[],7.3465e+17,7.3465e+17,sharma13avinash,Avinash - अविनाश,1,23,https://twitter.com/sharma13avinash/status/1262440534674563072,False,0,0,0,,(corona OR coronavirus OR covid OR pandemic OR lockdown OR quarantine OR covid-19 OR ppe),,"28.5934,77.2223,2000km",,,,,"[{'user_id': '734649640717582336', 'username': 'sharma13avinash'}, {'user_id': '711694309', 'username': 'AamAadmiParty'}, {'user_id': '405427035', 'username': 'ArvindKejriwal'}]",,,,,god   know   decis   kejriw   like   peopl   delhi   bcz   assumpt   decis   increas   covid   patient   delhi   economyvshealth   situat  ,-1
489,489,489,1.26281e+18,1.26281e+18,1589910000000.0,19-05-2020 23:56,530,,"We're all aware that the economy is going to take a massive hit due to the pandemic. But how harsh will the impact be?
#2YoDoINDIA #Economy pic.twitter.com/5mE1g7e5pc","['#2yodoindia', '#economy']",[],1.15437e+18,1.15437e+18,2yodoindia,2YoDo INDIA,2,23,https://twitter.com/2yodoindia/status/1262811759426994176,False,0,1,0,,(corona OR coronavirus OR covid OR pandemic OR lockdown OR quarantine OR covid-19 OR ppe),,"28.5934,77.2223,2000km",,,,,"[{'user_id': '1154365773957087232', 'username': '2yodoindia'}]",,,,,awar   economi   go   take   massiv   hit   due   pandem   harsh   impact   yodoindia   economi  ,-1
892,892,892,1.26279e+18,1.26279e+18,1589910000000.0,19-05-2020 22:25,530,,Country is copying Corna strategy from various countries it's similar to exam when student coping assumes the person knows everything and reality is the student has received out of syllabus paper 😱😱 #CallOfBoardExams #examscancelkaro #corona #economy #CoronaCrisis #pandemic,"['#callofboardexams', '#examscancelkaro', '#corona', '#economy', '#coronacrisis', '#pandemic']",[],1521260376.0,1521260376.0,raj_can,"Rajan Kothari, CPA, CA USA CAN Ind",2,22,https://twitter.com/raj_can/status/1262788914634305538,False,1,0,0,,(corona OR coronavirus OR covid OR pandemic OR lockdown OR quarantine OR covid-19 OR ppe),,"28.5934,77.2223,2000km",,,,,"[{'user_id': '1521260376', 'username': 'raj_can'}]",,,,,countri   copi   corna   strategi   variou   countri   similar   exam   student   cope   assum   person   know   everyth   realiti   student   receiv   syllabu   paper   callofboardexam   examscancelkaro   corona   economi   coronacrisi   pandem  ,0
1031,1031,1031,1.26317e+18,1.26317e+18,1590000000000.0,20-05-2020 23:46,530,,"Why is this #HinduMuslim fight is still going on & on.
Are not we able to dilute this at least for now, we have more things to talk about why’s this negativity & enmity for each other.
Can we please stop this.
#Hinduphobic_Bollywood #Covid_19 #Amphan #CyclonicStormAMPHAN #Economy","['#hindumuslim', '#hinduphobic_bollywood', '#covid_19', '#amphan', '#cyclonicstormamphan', '#economy']",[],2727420346.0,2727420346.0,ChetnaSingh,Chetna Singh,3,23,https://twitter.com/ChetnaSingh/status/1263171773962555400,False,3,1,0,,(corona OR coronavirus OR covid OR pandemic OR lockdown OR quarantine OR covid-19 OR ppe),,"28.5934,77.2223,2000km",,,,,"[{'user_id': '2727420346', 'username': 'ChetnaSingh'}]",,,,,hindumuslim   fight   still   go   abl   dilut   least   thing   talk   neg   enmiti   pleas   stop   hinduphob   bollywood   covid   amphan   cyclonicstormamphan   economi  ,-1
1051,1051,1051,1.26317e+18,1.26317e+18,1590000000000.0,20-05-2020 23:37,530,,What's going on in India when number of #corona case less in India #governmentofindia announced completely lockdown and when the cases exceed the numbers in lakhs #GOI opens everything..I think government didn't care about the #humanspecies they only think about the #economy ....,"['#corona', '#governmentofindia', '#goi', '#humanspecies', '#economy']",[],4356275478.0,4356275478.0,Piyush_verma_,Piyush verma (mona),3,23,https://twitter.com/Piyush_verma_/status/1263169426649571328,False,3,0,1,,(corona OR coronavirus OR covid OR pandemic OR lockdown OR quarantine OR covid-19 OR ppe),,"28.5934,77.2223,2000km",,,,,"[{'user_id': '4356275478', 'username': 'Piyush_verma_'}]",,,,,go   india   number   corona   case   le   india   governmentofindia   announc   complet   lockdown   case   exceed   number   lakh   goi   open   everyth   think   govern   care   humanspeci   think   economi  ,-1
1119,1119,1119,1.26316e+18,1.26316e+18,1590000000000.0,20-05-2020 23:18,530,,"“The pandemic has negatively impacted people’s #health, the #economy, and the already fragile #energy system, and the only viable response that can address all 3 aspects is harnessing the full power of #renewableenergy” – HE Dr. Al Zeyoudi @_AfricanUnion @IRENA pic.twitter.com/c5A92FcQYc","['#health', '#economy', '#energy', '#renewableenergy']",[],385843634.0,385843634.0,MoCCaEUAE,MoCCAE,3,23,https://twitter.com/MoCCaEUAE/status/1263164633222971394,False,16,1,7,,(corona OR coronavirus OR covid OR pandemic OR lockdown OR quarantine OR covid-19 OR ppe),,"28.5934,77.2223,2000km",,,,,"[{'user_id': '385843634', 'username': 'MoCCaEUAE'}, {'user_id': '145935897', 'username': '_AfricanUnion'}, {'user_id': '1926360631', 'username': 'IRENA'}]",,,,,pandem   neg   impact   peopl   health   economi   alreadi   fragil   energi   system   viabl   respons   address   aspect   har   full   power   renewableenergi   dr   al   zeyoudi  ,-1
2789,2789,2789,1.26386e+18,1.26386e+18,1590160000000.0,22-05-2020 21:07,530,,"From drought to floods, to the #COVIDー19 pandemic and #lockdown, it's not been a good year for the crushing season.

#sugarcane #sugarmills #agriculture #farmers #economy #Maharashtra @AgriGoI @CMOMaharashtra https://twitter.com/anvitasri/status/1263832164946210818 …","['#covidー19', '#lockdown', '#sugarcane', '#sugarmills', '#agriculture', '#farmers', '#economy', '#maharashtra']",[],2320526888.0,2320526888.0,prajaktajoshi19,Prajakta Joshi,5,21,https://twitter.com/prajaktajoshi19/status/1263856621429690369,False,1,0,0,https://twitter.com/anvitasri/status/1263832164946210818,(corona OR coronavirus OR covid OR pandemic OR lockdown OR quarantine OR covid-19 OR ppe),,"28.5934,77.2223,2000km",,,,,"[{'user_id': '2320526888', 'username': 'prajaktajoshi19'}, {'user_id': '1461447398', 'username': 'AgriGoI'}, {'user_id': '2597666894', 'username': 'CMOMaharashtra'}]",,,,,drought   flood   covid   pandem   lockdown   good   year   crush   season   sugarcan   sugarmil   agricultur   farmer   economi   maharashtra  ,-1
1004,1004,1004,1.26317e+18,1.26317e+18,1590000000000.0,20-05-2020 23:57,530,,"Watch my latest video on Recession due to Covid-19.
#Covid_19 #coronavirus #recession2020 #jobsearch #jobless #YouTube #Video #VideoViral #viralvideo #HumanResources #hiring #HIRINGNOW 
Watch full video here  https://youtu.be/oMXtnEZEX1c   pic.twitter.com/35fSWgbczo pic.twitter.com/F68opZk91N","['#covid_19', '#coronavirus', '#recession2020', '#jobsearch', '#jobless', '#youtube', '#video', '#videoviral', '#viralvideo', '#humanresources', '#hiring', '#hiringnow']",[],1.26084e+18,1.26084e+18,FitnessKtd,KTD World,3,23,https://twitter.com/FitnessKtd/status/1263174545944576000,False,0,0,0,,(corona OR coronavirus OR covid OR pandemic OR lockdown OR quarantine OR covid-19 OR ppe),,"28.5934,77.2223,2000km",,,,,"[{'user_id': '1260841009933545472', 'username': 'FitnessKtd'}]",,,,,watch   latest   video   recess   due   covid   covid   coronaviru   recess   jobsearch   jobless   youtub   video   videovir   viralvideo   humanresourc   hire   hiringnow   watch   full   video  ,-1
1205,1205,1205,1.26316e+18,1.26316e+18,1590000000000.0,20-05-2020 22:52,530,,How #Corona turned somebody’s life track and now forced into do like this kind of tuff job..! #Report #Mumbai #labour #work #jobsearch @mumbaitak @TanushreePande @sahiljoshii https://twitter.com/sardesairajdeep/status/1263117331682582528 …,"['#corona', '#report', '#mumbai', '#labour', '#work', '#jobsearch']",[],1487553457.0,1487553457.0,AdriftRider,Prashanth Bhat (AdriftRider),3,22,https://twitter.com/AdriftRider/status/1263158227350556674,False,0,0,0,https://twitter.com/sardesairajdeep/status/1263117331682582528,(corona OR coronavirus OR covid OR pandemic OR lockdown OR quarantine OR covid-19 OR ppe),,"28.5934,77.2223,2000km",,,,,"[{'user_id': '1487553457', 'username': 'AdriftRider'}, {'user_id': '944460562540273664', 'username': 'mumbaitak'}, {'user_id': '2559281330', 'username': 'TanushreePande'}, {'user_id': '107646921', 'username': 'sahiljoshii'}]",,,,,corona   turn   somebodi   life   track   forc   like   kind   tuff   job   report   mumbai   labour   work   jobsearch  ,-1
1004,1004,1004,1.26317e+18,1.26317e+18,1590000000000.0,20-05-2020 23:57,530,,"Watch my latest video on Recession due to Covid-19.
#Covid_19 #coronavirus #recession2020 #jobsearch #jobless #YouTube #Video #VideoViral #viralvideo #HumanResources #hiring #HIRINGNOW 
Watch full video here  https://youtu.be/oMXtnEZEX1c   pic.twitter.com/35fSWgbczo pic.twitter.com/F68opZk91N","['#covid_19', '#coronavirus', '#recession2020', '#jobsearch', '#jobless', '#youtube', '#video', '#videoviral', '#viralvideo', '#humanresources', '#hiring', '#hiringnow']",[],1.26084e+18,1.26084e+18,FitnessKtd,KTD World,3,23,https://twitter.com/FitnessKtd/status/1263174545944576000,False,0,0,0,,(corona OR coronavirus OR covid OR pandemic OR lockdown OR quarantine OR covid-19 OR ppe),,"28.5934,77.2223,2000km",,,,,"[{'user_id': '1260841009933545472', 'username': 'FitnessKtd'}]",,,,,watch   latest   video   recess   due   covid   covid   coronaviru   recess   jobsearch   jobless   youtub   video   videovir   viralvideo   humanresourc   hire   hiringnow   watch   full   video  ,-1
2406,2406,2406,1.26388e+18,1.26388e+18,1590170000000.0,22-05-2020 22:46,530,,"GMC Hummer EV uncover delayed due to COVID-19

Browse  http://www.ealmihtig.com  to check the details of the first ever electric SUV

#electric #automobile #car #ealmihtig #futurecars #cars #carsofinstagram #instacar #speed…  https://www.instagram.com/p/CAf4lPxDtAu/?igshid=xv9b9vdofvoa …","['#electric', '#automobile', '#car', '#ealmihtig', '#futurecars', '#cars', '#carsofinstagram', '#instacar', '#speed']",[],1.10652e+18,1.10652e+18,ealmihtig,Vinay Sharma,5,22,https://twitter.com/ealmihtig/status/1263881406247243776,False,1,0,1,,(corona OR coronavirus OR covid OR pandemic OR lockdown OR quarantine OR covid-19 OR ppe),,"28.5934,77.2223,2000km",,,,,"[{'user_id': '1106516494748250112', 'username': 'ealmihtig'}]",,,,,gmc   hummer   ev   uncov   delay   due   covid   brows   check   detail   first   ever   electr   suv   electr   automobil   car   ealmihtig   futurecar   car   carsofinstagram   instacar   speed  ,0
5107,5107,5107,1.26533e+18,1.26533e+18,1590510000000.0,26-05-2020 22:24,530,,"Is @TataMotors @RNTata2000  offline in this lockdown...??? 

#automobile #COVID__19 #consumeraffairs #laddakh https://twitter.com/YogeshG97380334/status/1264872189570015232 …","['#automobile', '#covid__19', '#consumeraffairs', '#laddakh']",[],9.23207e+17,9.23207e+17,YogeshG97380334,Yogesh Gupta,2,22,https://twitter.com/YogeshG97380334/status/1265325363598516224,False,0,1,0,https://twitter.com/YogeshG97380334/status/1264872189570015232,(corona OR coronavirus OR covid OR pandemic OR lockdown OR quarantine OR covid-19 OR ppe),,"28.5934,77.2223,2000km",,,,,"[{'user_id': '923207134166372357', 'username': 'YogeshG97380334'}, {'user_id': '727662488', 'username': 'TataMotors'}, {'user_id': '277434037', 'username': 'RNTata2000'}]",,,,,offlin   lockdown   automobil   covid   consumeraffair   laddakh  ,-1
2601,2601,2601,1.26387e+18,1.26387e+18,1590160000000.0,22-05-2020 21:49,530,,💻Want more Sales and Leads for your Business or want to create your Brand Awareness?📲Grow your Business during Lockdown with your Business Website.HURRY UP!CONTACT US📞#StaySafe #StayHealty #websitedesigningdelhi #businessneeds #websitedesigningservices #delhibusiness #website pic.twitter.com/OYiYB7bTar,"['#staysafe', '#stayhealty', '#websitedesigningdelhi', '#businessneeds', '#websitedesigningservices', '#delhibusiness', '#website']",[],1.23198e+18,1.23198e+18,digiitsolution,Digi IT Solution,5,21,https://twitter.com/digiitsolution/status/1263867107852218369,False,0,0,0,,(corona OR coronavirus OR covid OR pandemic OR lockdown OR quarantine OR covid-19 OR ppe),,"28.5934,77.2223,2000km",,,,,"[{'user_id': '1231976461197701120', 'username': 'digiitsolution'}]",,,,,want   sale   lead   busi   want   creat   brand   awar   grow   busi   lockdown   busi   websit   hurri   contact   u   staysaf   stayhealti   websitedesigningdelhi   businessne   websitedesigningservic   delhibusi   websit  ,0
3984,3984,3984,1.26458e+18,1.26458e+18,1590330000000.0,24-05-2020 21:09,530,,"Eid Mubarak!
.
.
.
.
.
.
.
.

Lockdown Time.
.
.
.
.
#ramadan2020 #instagood #instadaily #insta #followforfollowback #followers #instafollow #blogger #business #publicrelations #eventplanner #publicfigure #today…  https://www.instagram.com/p/CAk3Fd4p4Bp/?igshid=yh2rk021yipc …","['#ramadan2020', '#instagood', '#instadaily', '#insta', '#followforfollowback', '#followers', '#instafollow', '#blogger', '#business', '#publicrelations', '#eventplanner', '#publicfigure', '#today']",[],436665875.0,436665875.0,sameer_svhyd,Sameer Sheikh,7,21,https://twitter.com/sameer_svhyd/status/1264581805065285636,False,1,0,0,,(corona OR coronavirus OR covid OR pandemic OR lockdown OR quarantine OR covid-19 OR ppe),,"28.5934,77.2223,2000km",,,,,"[{'user_id': '436665875', 'username': 'sameer_svhyd'}]",,,,,eid   mubarak   lockdown   time   ramadan   instagood   instadaili   insta   followforfollowback   follow   instafollow   blogger   busi   publicrel   eventplann   publicfigur   today  ,1
4541,4541,4541,1.26496e+18,1.26496e+18,1590420000000.0,25-05-2020 21:59,530,,"To create awareness about  health business economy and living for 1000 of  our  hardworking citizens.

STAY TUNED 
 https://instagram.com/theyaha_events?igshid=gy1fff9qlral …
FOLLOW @TheyahaE
#India #punekar #Maharashtra #eidmubarak2020 #people #mondaythoughts #lockdown #businessgrowth #Modi #legends #positivity pic.twitter.com/HDynzf3Mtj","['#india', '#punekar', '#maharashtra', '#eidmubarak2020', '#people', '#mondaythoughts', '#lockdown', '#businessgrowth', '#modi', '#legends', '#positivity']",[],1.17826e+18,1.17826e+18,TheyahaE,Theyaha_events,1,21,https://twitter.com/TheyahaE/status/1264956838581342208,False,2,0,2,,(corona OR coronavirus OR covid OR pandemic OR lockdown OR quarantine OR covid-19 OR ppe),,"28.5934,77.2223,2000km",,,,,"[{'user_id': '1178264142320267265', 'username': 'TheyahaE'}]",,,,,creat   awar   health   busi   economi   live   hardwork   citizen   stay   tune   follow   india   punekar   maharashtra   eidmubarak   peopl   mondaythought   lockdown   businessgrowth   modi   legend   posit  ,-1
5263,5263,5263,1.26532e+18,1.26532e+18,1590510000000.0,26-05-2020 21:48,530,,"People are more distressed 🤯 due to immediate #health impacts of COVID-19,including
☹️ Physical/social isolation
☹️ #Fear of #businessloss
🙁 Loss of near & dear ones
🙁 #unemployment 
Govt needs urgently focus for mental health to prevent  increase in mental health condition  https://twitter.com/anandmahindra/status/1264851749422202880 … pic.twitter.com/RK8NgZeat9","['#health', '#fear', '#businessloss', '#unemployment']",[],102003385.0,102003385.0,tsareshwala,Talha Sareshwala,2,21,https://twitter.com/tsareshwala/status/1265316361737252867,False,0,0,1,,(corona OR coronavirus OR covid OR pandemic OR lockdown OR quarantine OR covid-19 OR ppe),,"28.5934,77.2223,2000km",,,,,"[{'user_id': '102003385', 'username': 'tsareshwala'}]",,,,,peopl   distress   due   immedi   health   impact   covid   includ   physic   social   isol   fear   businessloss   loss   near   dear   one   unemploy   govt   need   urgent   focu   mental   health   prevent   increas   mental   health   condit  ,1
5574,5574,5574,1.2657e+18,1.2657e+18,1590600000000.0,27-05-2020 23:14,530,,"#icantbreathe #wednesdaymorning #coronavirus #MotivationalQuotes #Motivation #business #Covid_19 #Corona 

Don't wait to be perfect, Start taking actions  pic.twitter.com/gub1bJHgBL","['#icantbreathe', '#wednesdaymorning', '#coronavirus', '#motivationalquotes', '#motivation', '#business', '#covid_19', '#corona']",[],154743455.0,154743455.0,tauseef786hasan,Tauseefpro,3,23,https://twitter.com/tauseef786hasan/status/1265700374188634112,False,0,0,0,,(corona OR coronavirus OR covid OR pandemic OR lockdown OR quarantine OR covid-19 OR ppe),,"28.5934,77.2223,2000km",,,,,"[{'user_id': '154743455', 'username': 'tauseef786hasan'}]",,,,,icantbreath   wednesdaymorn   coronaviru   motivationalquot   motiv   busi   covid   corona   wait   perfect   start   take   action  ,0
6137,6137,6137,1.26607e+18,1.26599e+18,1590690000000.0,28-05-2020 23:53,530,,"In @Navsari corona cases rising. 
Proper screening of people coming from out of Navsari should be followed.

Y harass the local people without their fault . #BusinessLoss

Till yesterday i was promoting #stoptargetinggujarat
Nw i think
#GujaratModelFailed https://twitter.com/Neel_AOL/status/1265957512072671233?s=19 …","['#businessloss', '#stoptargetinggujarat', '#gujaratmodelfailed']",[],9.30453e+17,9.30453e+17,Neel_AOL,Neel Sanatani,4,23,https://twitter.com/Neel_AOL/status/1266072516432281602,False,0,0,0,https://twitter.com/Neel_AOL/status/1265957512072671233,(corona OR coronavirus OR covid OR pandemic OR lockdown OR quarantine OR covid-19 OR ppe),,"28.5934,77.2223,2000km",,,,,"[{'user_id': '930453047452434437', 'username': 'Neel_AOL'}, {'user_id': '627355202', 'username': 'vijayrupanibjp'}, {'user_id': '8955132', 'username': 'Navsari'}]",,,,,corona   case   rise   proper   screen   peopl   come   navsari   follow   harass   local   peopl   without   fault   businessloss   till   yesterday   promot   stoptargetinggujarat   nw   think   gujaratmodelfail  ,-1
